{
  "$schema": "../../../schemas/n8n-data-tables.schema.json",
  "schema_version": "1.0.0",
  "contract_id": "INF-005",
  "contract_status": "development",
  "n8n_version": "2.36.9",
  "project": {
    "id": "o8RQQQgne2c6jXr5",
    "name": "INTRST Films"
  },
  "storage_policy": {
    "documents_and_media_authority": "google_drive",
    "operational_state_authority": "n8n_data_tables",
    "nested_values": "json_encoded_string",
    "timestamps": "utc",
    "logical_uniqueness": "workflow_enforced",
    "secrets_allowed": false
  },
  "open_dependencies": [
    {
      "id": "INF-006-SUBJECT-ID",
      "decision": "Operational tables use subject_id; the unchanged Life File payload retains its canonical person_id field until INF-006 formally resolves the alias."
    },
    {
      "id": "INF-005-OBSERVABILITY",
      "decision": "The approved eight-table set does not include workflow_runs; production observability persistence requires a canonical decision before workflow deployment."
    }
  ],
  "deployment": {
    "environment": "development",
    "status": "planned",
    "mutation_authorized_by": "user_request_2026-09-03",
    "expected_current_state": "no_inf_005_tables",
    "idempotency_key": "INF-005:o8RQQQgne2c6jXr5:1.0.0",
    "rollback_method": "archive_only_tables_created_by_this_deployment_after_project_scoped_id_verification"
  },
  "tables": [
    {
      "name": "people_queue",
      "purpose": "Candidate-subject intake and editorial research authorization queue.",
      "logical_key": ["subject_id"],
      "idempotency_key": ["idempotency_key"],
      "columns": [
        {"name": "subject_id", "type": "string", "required": true},
        {"name": "full_name", "type": "string", "required": true},
        {"name": "display_name", "type": "string", "required": true},
        {"name": "category", "type": "string", "required": true},
        {"name": "trigger_type", "type": "string", "required": true},
        {"name": "trigger", "type": "string", "required": true},
        {"name": "source_url", "type": "string", "required": false},
        {"name": "candidate_reason", "type": "string", "required": false},
        {"name": "story_value_score", "type": "number", "required": false},
        {"name": "urgency_score", "type": "number", "required": false},
        {"name": "priority", "type": "string", "required": true},
        {"name": "queue_status", "type": "string", "required": true},
        {"name": "assigned_to", "type": "string", "required": false},
        {"name": "approved_by", "type": "string", "required": false},
        {"name": "approved_at", "type": "date", "required": false},
        {"name": "idempotency_key", "type": "string", "required": true},
        {"name": "created_at", "type": "date", "required": true},
        {"name": "updated_at", "type": "date", "required": true}
      ]
    },
    {
      "name": "life_files",
      "purpose": "Versioned Life File metadata and schema-validated structured payload.",
      "logical_key": ["life_file_id", "version"],
      "idempotency_key": ["subject_id", "version"],
      "columns": [
        {"name": "life_file_id", "type": "string", "required": true},
        {"name": "subject_id", "type": "string", "required": true},
        {"name": "schema_version", "type": "string", "required": true},
        {"name": "version", "type": "string", "required": true},
        {"name": "status", "type": "string", "required": true},
        {"name": "drive_document_url", "type": "string", "required": true},
        {"name": "payload_json", "type": "string", "required": true},
        {"name": "payload_hash", "type": "string", "required": true},
        {"name": "claim_count", "type": "number", "required": true},
        {"name": "verified_claim_count", "type": "number", "required": true},
        {"name": "open_claim_count", "type": "number", "required": true},
        {"name": "high_risk_claim_count", "type": "number", "required": true},
        {"name": "source_count", "type": "number", "required": true},
        {"name": "last_researched_at", "type": "date", "required": false},
        {"name": "editorial_owner", "type": "string", "required": false},
        {"name": "idempotency_key", "type": "string", "required": true},
        {"name": "created_at", "type": "date", "required": true},
        {"name": "updated_at", "type": "date", "required": true}
      ]
    },
    {
      "name": "story_objects",
      "purpose": "Approved evidence-bound Story Objects consumed by derivative workflows.",
      "logical_key": ["story_object_id", "editorial_version"],
      "idempotency_key": ["subject_id", "editorial_version"],
      "columns": [
        {"name": "story_object_id", "type": "string", "required": true},
        {"name": "subject_id", "type": "string", "required": true},
        {"name": "subject_name", "type": "string", "required": true},
        {"name": "schema_version", "type": "string", "required": true},
        {"name": "editorial_version", "type": "string", "required": true},
        {"name": "life_file_version", "type": "string", "required": false},
        {"name": "story_bible_version", "type": "string", "required": false},
        {"name": "approval_state", "type": "string", "required": true},
        {"name": "rights_status", "type": "string", "required": true},
        {"name": "asset_identity_status", "type": "string", "required": true},
        {"name": "visual_mode", "type": "string", "required": true},
        {"name": "payload_json", "type": "string", "required": true},
        {"name": "payload_hash", "type": "string", "required": true},
        {"name": "approved_by", "type": "string", "required": false},
        {"name": "approved_at", "type": "date", "required": false},
        {"name": "idempotency_key", "type": "string", "required": true},
        {"name": "created_at", "type": "date", "required": true},
        {"name": "updated_at", "type": "date", "required": true}
      ]
    },
    {
      "name": "content_outputs",
      "purpose": "One operational record per derivative or editorial output and version.",
      "logical_key": ["output_id", "version"],
      "idempotency_key": ["story_object_id", "output_type", "version"],
      "columns": [
        {"name": "output_id", "type": "string", "required": true},
        {"name": "story_object_id", "type": "string", "required": true},
        {"name": "subject_id", "type": "string", "required": true},
        {"name": "output_type", "type": "string", "required": true},
        {"name": "parent_output_id", "type": "string", "required": false},
        {"name": "manifest_id", "type": "string", "required": true},
        {"name": "manifest_version", "type": "string", "required": true},
        {"name": "version", "type": "string", "required": true},
        {"name": "status", "type": "string", "required": true},
        {"name": "script_drive_url", "type": "string", "required": false},
        {"name": "media_drive_url", "type": "string", "required": false},
        {"name": "thumbnail_drive_url", "type": "string", "required": false},
        {"name": "claim_ids_json", "type": "string", "required": true},
        {"name": "asset_ids_json", "type": "string", "required": true},
        {"name": "manifest_json", "type": "string", "required": true},
        {"name": "editorial_approval", "type": "boolean", "required": true},
        {"name": "rights_clearance", "type": "boolean", "required": true},
        {"name": "publish_clearance", "type": "boolean", "required": true},
        {"name": "created_by", "type": "string", "required": true},
        {"name": "approved_by", "type": "string", "required": false},
        {"name": "idempotency_key", "type": "string", "required": true},
        {"name": "created_at", "type": "date", "required": true},
        {"name": "updated_at", "type": "date", "required": true}
      ]
    },
    {
      "name": "approval_queue",
      "purpose": "Unified, explicit human-review queue for sensitive gates.",
      "logical_key": ["review_id"],
      "idempotency_key": ["entity_type", "entity_id", "review_type"],
      "columns": [
        {"name": "review_id", "type": "string", "required": true},
        {"name": "entity_type", "type": "string", "required": true},
        {"name": "entity_id", "type": "string", "required": true},
        {"name": "review_type", "type": "string", "required": true},
        {"name": "priority", "type": "string", "required": true},
        {"name": "reason", "type": "string", "required": true},
        {"name": "story_object_id", "type": "string", "required": false},
        {"name": "subject_id", "type": "string", "required": false},
        {"name": "assigned_to", "type": "string", "required": false},
        {"name": "status", "type": "string", "required": true},
        {"name": "requested_at", "type": "date", "required": true},
        {"name": "reviewed_at", "type": "date", "required": false},
        {"name": "decision", "type": "string", "required": false},
        {"name": "decision_actor", "type": "string", "required": false},
        {"name": "notes", "type": "string", "required": false},
        {"name": "idempotency_key", "type": "string", "required": true},
        {"name": "created_at", "type": "date", "required": true},
        {"name": "updated_at", "type": "date", "required": true}
      ]
    },
    {
      "name": "publishing_log",
      "purpose": "One platform-native publishing instruction and result per output and platform.",
      "logical_key": ["publishing_log_id"],
      "idempotency_key": ["output_id", "platform", "instruction_version"],
      "columns": [
        {"name": "publishing_log_id", "type": "string", "required": true},
        {"name": "output_id", "type": "string", "required": true},
        {"name": "story_object_id", "type": "string", "required": true},
        {"name": "subject_id", "type": "string", "required": true},
        {"name": "platform", "type": "string", "required": true},